review,rating
"4.5 starsSergei Stolkov is a young captain in the Coalition Forces; he believes completely in the Doctrine but isn't too thrilled with his current assignment as aide to a general on the planet of Cirokko. He is unsure it's in the best interest of the coalition to try to conquer Cirokko, and fears it will once again earn its nickname, Fool's Gamit.  Added to his frustration with the mission objective, his mixed feelings about the brother General he serves causes his life to be mostly a waking nightmare. But Sergei is a good soldier, trained to serve and not question, he will unswervingly do as ordered.Mike is a CovOp operative, embedded with the rebel's of Cirokko, he and his partner Pat are masters at what they do. Pat's mission is to embed himself with rebels in the mountains, Mike's to blend into the local culture of the provincial capital of Dedis and embed himself with the Coalition Forces by seducing one of its officers. He speaks both the local language as well as Doctrine standard fluently. While adept at any kind of weapon his best weapon is his own body and mind, both of which he intends to use to his advantage.Mike not only seduces himself into Sergei's bed but into his heart as well.  Unfortunately for Mike, what starts out as an op soon turns personal, and he finds himself not pretending to fall for Sergei but actually landing head first in love with him. Now the games begin, Mike has to try to do his job while trying to protect Sergei. Sergei must try to reconcile what he and the doctrine consider unnatural feelings for Mike against his duty. Both will have their minds, bodies and souls put to extreme tests and both will discover just how deep their love goes.As a team Aliksandr Voinov and Rhianon Etzweiler have created a world of intrigue, betrayal and seduction with such skill that from the first sentence the reader knows they are going to be in for a ride. While the story takes place in another time and place and is full of alien names and references, it is so well told that it's easy to feel exactly what Mike and Sergei experience.We meet Mike and Pat first as they watch a coalition convey traversing the long way around the Zasidka Pass, a pass that has been the ruin of many a mission and will play a big part in the story (that's the only spoiler I'll give about that). Immediately we learn Mike is a rugged man, well suited to his job and with a slightly off center sense of humor. Pat is a bit of a curmudgeon, it's clear why he stays in the background and Mike does the front work. As with all partners, they get on each others nerves but have each others backs as well. As the story progresses we learn a lot about Mike but Pat remains a bit of a mystery.Our first meeting with Sergei shows us he is a team player but not a happy camper. We soon learn what it is about the brother General that causes him to be conflicted and trust me, it isn't pretty.  Sergei is a well trained soldier, the coalition forces are referred to as zombies, and Sergei has the act down pat. He is able to control his emotions and it's impossible to tell his thoughts by looking at this face.The first meeting of Mike and Sergei pretty much sets the tone for their relationship throughout the book. Mike is the more mature of the two and certainly the more experienced. While the book is chock full of military action and intrigue, for me the conflict both men faced was the meat of the book. There were scenes that were painful to read, the authors pulled no punches and didn't pretty it up. I enjoyed this book immensely, I can't think of a thing to complain about in it, which is rare indeed for me. Why not 5 stars? It was a good book and I enjoyed it, but I didn't feel myself needing to read it to the end in one sitting. I don't hesitate to recommend this book to readers of science fiction, readers of romance, and readers of just a darn good story.My usual cautions apply - there is unspeakable graphic violence, there is M/M sex- some very graphic, there are not nice things happening but none of it should make the mature reader uncomfortable.Member of the Paranormal Romance Guild Dual Review Team",4.0
"This is a really good book to read. It is very informative. Diabetes is a chronic disease. Diabetes Type 1 is genetically linked and Type 2 can at times be relieved by modifications to lifestyle. This book has important information for us to combat diabetes. It highlights symptoms of Type 1 & 2, risk factors, treatments, diet, and how exercise is a key component to health. It is worth reading, so I would like to recommend it to everyone.",5.0
"When Madison's sister dies and she inherits the Naughty Bits lingerie shop she sees it as the perfect opportunity to get away from her boring job and start a new life for herself. She didn't realise how hard it would be to turn her hand to selling sex toys though and it looks like she's going to need some help learning how to make her customers comfortable. She has been burying her submissive side for so long that she has no idea who she really is any more and the incredibly sexy Dom from the shop next door seems to be more than willing to help her loosen up a little. Can she be brave enough to take a risk with Logan or will her new career end in disaster?I have a confession - I've never read anything by Joey W. Hill before. I've heard so many good things about her books though so when I got the opportunity to review this one I jumped at the chance to read it. I have to admit that while I liked the story it didn't wow me as much as I hoped it would. I have now come to the conclusion that serial novels are just not for me. I want to be able to read the whole story in one sitting and I do honestly think that if this story had been released as a full length novel I would have happily carried on to the end and probably really enjoyed it. The problem is that this part didn't grab me enough to make me spend the money it will cost to buy the remaining three instalments. Another issue with serials is that they nearly always work out more expensive than buying a full length book and that makes me very reluctant to part with my money. Add in the fact that this book is releasing in monthly instalments so the final part won't be available until July and I can pretty much guarantee these characters will be completely off my radar by then (when you consider that I'll probably read at least 80 books between now and then it's no surprise that something has to be INCREDIBLY special to hold my attention for that length of time).Madison is an interesting character but I found it very hard to relate to her, she is so sexually repressed and embarrassed about her desires and I don't like the way she pushes everyone away. We do see her start to explore her fantasies a little by the end of the novella though and I have a feeling she's going to go on a real emotional journey as well as a sexual awakening throughout the series which should be interesting to see. I'm hoping she'll become a lot more likeable by the end of the series because I really did want shake her and tell her to get a grip at times. I enjoyed the humour of seeing Madison thrown in the deep end with her sister's lingerie shop though, she is so incredibly naive and now she's supposed to be advising customers and selling sex toys which was very amusing.At the moment I think Logan is the main draw for me to want to continue the series, he runs the hardware shop next door to Naughty Bits but he also builds custom made BDSM equipment and trains submissives on the side. Logan was also good friends with Madison's sister Alice and she asked him to keep an eye on her after she was gone. Alice knew Madison inside out even though they've been estranged so I think she was aware of how much Madison needs to be pushed if she's ever going to learn to let herself go and loosen up and I'm pretty sure Logan is the perfect man for the job. My main complaint was that we didn't get enough of him in this instalment but hopefully that will be remedied as the series continues.Unfortunately this novella cuts off the story just as things are starting to get interesting, I would like to know what happens next but I doubt I'll continue with the series unless it is released as a bind up for a reasonable price. I'm not going to be forced into paying more than normal for a novel just because it has been split into four chunks. Die hard Joey W. Hill fans or people who like this new trend of serial novels will probably be happy to start the series now but otherwise my suggestion is to wait until July & then give it a try when at least you're not going to have to wait on a cliffhanger between each new instalment.",3.0
"Hailey is a preschool teacher who has been taking care of her younger sister for most of their lives. When her sister returns home pregnant after touring with the band Half-Life Hailey decides it is her responsibility to figure out the father is and make him take responsibility. She borrows some of her sisters &#34;wild&#34; clothing and goes to the hotel to try and get some answers. She runs into Lock, the lead singer of Half-Life who agrees to let her hang around and ask questions in exchange for three days of being at his beck and call. One contract alter and Hailey finds herself experiencing an intense sexual connection unlike any she has knows. While she struggles to get information about her sister, she also struggles with forming an attachment to a man she knows she will never see again when the contract expires when the three days are up. Lock finds himself experiencing all kinds of emotions he never expected when he and Hailey start their sexual relationship. He has messed up a lot in his life and with his band, but one year sober he is going to start to try and make some better decisions from her on in.While the theme of a sexual situation relationship turning emotional isn't a new concept, and neither is the elusive rock star falling for a &#34;real&#34; woman, this book managed to keep things interesting and fresh. I liked that the story wasn't about the rough and raw rock star turning everything around for a woman, but rather two people feeling a strong connection and finding that they could give each other a sexual connection that they both needed. The chemistry between Hailey and Lock was definitely hot, and the sexy scenes were very sexy. The story line with Hailey's sister Chloe was interesting as well, and I liked seeing that play out. I enjoyed that these characters weren't black and white and that they were each complex in they own way, as people in real life are. One thing I would have liked is a little more of everything. A little more development of each character and their story. That said, this book held my interest throughout and I will gladly read more in this series. 3.5 stars.",3.0
"I had no idea that there were animals that didn't age. Long lived... yes, but immortal...?  What a great subject to read about!This book is very well written and draws you in immediately with fascinating facts about animals that could conceivably live forever (if they didn't get eaten, sick etc). Not only does the author mention animals that are immortal, but she goes into the 'whys' of the matter too, albeit briefly, which is perfect for reading this book to children.I read this book on the kindle paperwhite and whilst the photos were in black and white, they were clear and easy to see.I would definitely recommend this book to any parent with children interested in animals.",5.0
"What a cute story! It involves a young girl and her Dad, visiting family in Scotland, so you get a splash of Scottish culture and folklore mixed in. The story unfolds with a surprising twist as Amy learns of a dragon, Argyle. Without giving away the ending, you should read this book to find out what happens for yourself! Well-written with nice illustrations, this book is fun to read with the whole family. It gives you a small taste of a different culture, as well as teaches you to be open to making new friends.",5.0
Good grouping of stories that allows you to escape into different characters and backgrounds. These are good to read and relax with anytime of the day.,4.0
I got this book as a free download and I really liked it.  It was a nice read with likable characters and plenty of ups and downs you expect in a romance novel.  The only thing that I did not care for too much was the way the main character would talk to her when he was upset with her.  I do agree with some of the other reviews that the end feels rushed but overall I found it to be an enjoyable read and I had a hard time putting it down.,4.0
"I liked this book because I am a retired teacher, so reading a story so different from my experiences was interesting.",4.0
I have dabbled in writing Kindle books and I must admit sometimes I struggle.  This book is an invaluable writing companion.  There are many tips on how to efficiently write and as important wonderful marketing tips.  I only wish I had this book as a reference before I attempted to write my first book.,5.0
"This thrift store is huge! The furniture is often well priced and there is a wide selection of clothes, dishes, books, decor, kids toys, movies...etc.",5.0
I just love her story in this book. It's a must read for any women who have been in a relationship that was a love-hate or anyone who knows someone who has been in one!!!,5.0
"The Blades of the Old Empire is the first book in the new Majat Code Series.  It is an epic fantasy that follows Kythan Dorn, a young prince with rare elemental magic, and his companions.  Kyth&#8217;s life changes forever when mysterious men from a cult was outlawed centuries ago attack him and his friends, and it turns out these men have strange powers of their own.  When the Kaddim cult realizes that their power works neither on Kyth or his Majat Warrior bodyguard Kara, Kyth and Kara end up at the top of the Kaddim&#8217;s hit list.  Kyth, his stepbrother Alder, and Kara go on a mission to find support from the grasslands, trying to avoid the schemes of the Kaddim along the way.  At the same time Kyth&#8217;s friend Ellah goes with his father and the Keepers, hoping to learn some of the Keeper healing secrets, and how to enhance her own ability to tell whether or not someone speaks the truth.  Unless Kyth and his father can get support from other leaders in the land, the church, which has been infiltrated by the Kaddim cult, will execute Kyth because of his powers and depose his father from the throne.I realize that this description of the plot sounds a bit convoluted, but the author plops the reader right down in the middle of the story, and it takes a while to discern what exactly is happening in the story.  This makes it hard to do a short description because I had very little backstory to explain before having to relate the setup of the plot. This is not necessarily a bad thing.  There are many amazing books like The Black Company or the Malazan books that put reader down in the middle of the action with little to no explaination.  Blades of the Empire is an enjoyable book, and once you get familiar with the characters and the setting, it is easy to route for the protagonists and against the antagonists.  The book is also a fast paced read, and it contains plenty of action.  The Majat Warriors in particular are very fascinating characters, and I would love to learn more about them in further books.  There are also many hints of an older, not quite extinct society, which could be expanded upon a lot more as the series goes on.  There is also an element of romance to this book, and I liked that it was tasteful and did not completely overwhelm the story line.  This book is action packed from the very first page, and is a good start to a series that I will look forward to reading more of.I would have enjoyed this book a bit more if there had been more world building.  The story went so fast that I did not feel immersed in the world, and I would have liked to be a little more familiar with each character.  The plotline was explained sufficiently, and after a while the plot was easy to follow, but it was not explained with the level of detail that I am partial to, or that I think most readers require to bring them into the story.Overall, this was an entertaining, but not completely engaging story.  The series does have a lot of potential, and I plan on reading the next book in the Majat Code series to see if there is more world building.  I would rate this book a 7/10.I received a copy of this book from Netgalley and the publisher in return for an honest review.",4.0
I expected so much more from this series...emotionally it felt flat ...kept waiting for me to care about the lead girl character  but i just didn't give a s***...self-centered character...I don't care how much money she gave away...flaky as hell...Tyler was a great character and kept me interested..he is the only reason I finished the book..couldn't believe the premis..misunderstood church girl ....to bimbo pornstar...it was just too much to handle..,2.0
"I knew before I even started this book that I was going to love it. It's written by Cardeno C., whom I am a giant fan of, it's the fourth book in the 'Home' series and I have loved the three previous books, and the premise of love at first sight is something I believe in and which happened to me when I met my husband. So, before I even opened the book, I had a trifecta of goodness happening.It took me about two paragraphs to fall completely in love with Jonathan. He's shy, sweet, gentle, naive, clumsy, easily distracted, loving, lonely, hates to disappoint anyone, and he doesn't do confrontation. These characteristics made for an amazing man, but they also helped to create the mess that Jonathan found himself in at the age of eighteen. He let his best friend accost him on the night of their graduation and take his virginity because she was angry at her boyfriend. During his graduation/class trip to New York, Jonathan saw a man and fell in love at first sight, leading Jonathan to move to the city in hopes of finding him. Because of his oopsie with his best friend, he finds out he's going to be a father, and in his loneliness and despair Jonathan ends up involved in internet gay porn. That's a lot to have happen at the age of eighteen. Luckily for Jonathan the police raid one of the porn sets and he meets Officer Jake Owens. (Ring a bell, fans? 'Where He Ends and I Begin')Jonathan gets his life together in time for his son, Samuel's, appearance. Jonathan is a wonderful dad and after three years in New York he decides it's time to give up his foolish hope of finding his soul mate, the man with the blue eyes he saw that one time, and he returns home with Samuel to build a life where his son has family. On his birthday his parents send him out the door and he finds himself in a bar, a place he hasn't been in years, and just Jonathan's luck some jerk recognizes him from his porn days and tries to make Jonathan come home with him. Jonathan is saved by the bar's owner who happens to be.....ta daa.....his soul mate, the man with the blue eyes. Jonathan faints right at his feet. I love him, he's so stinking adorable.David is fascinated by this gorgeous young man who makes him want things he's never desired before. Jonathan makes David think of forever and that this honest guy who embarrasses so easily and blushes at a dime might just be his for life. David is a little older, established in his life, and there are things he doesn't discuss with other people: his family, his childhood and his feelings being primary. So David is a little shocked to realize he wants to open up to Jonathan. When Jonathan leaves early the following morning and tells David he can't spend the weekend with him, it sets off a chain reaction leaving David to do a whole lot of soul searching so he can get Jonathan back in his life. Of course, David has no idea about the worst (the porn) and the best (Sam) things in Jonathan's life as Jonathan doesn't want to scare David away.There wasn't anything that I didn't love about this book. I realize I say that a lot about Cardeno C.'s work, but the author really is that good and I feel as if I'm right there immersed within the story. Watching David and Jonathan fall in love was intense and amazing. Seeing what happened after Jonathan told David that he'd fallen in love with him when he saw him in New York, and then revealing about his past porn life, just reinforced my belief that there are good, decent people in the world who know how to love through thick and thin. Thank you, Cardeno, for the much needed reminder and another beautiful story!NOTE: This book was provided by Dreamspinner Press for the purpose of a review on Rainbow Book Reviews",5.0
"These days it's difficult to catch children's attention - they can spend all day watching tv, playing on X-box or their mobiles. But I took a risk and decided to try get my little sister's attention with some book. And because I loved ghost stories when I was a kid (Scooby Doo), my choice was fairly easy. Well, needles to say, we got so involved in the story that just under an hour of time went just like that. The story is easy to read as well as easy to understand for a child. Looking forward to finding more books like this one.",5.0
this was my first book by Crystal and I absolutely loved it. I most definitely will be reading more of your work. I will be telling everyone about your work. get job sis!! let me go get started t part two.,5.0
This is the first time I read a Christian romance and I must say it was very good. I was hooked from the first couple of chapters and read the book in two days,5.0
"Of all the screen protectors I've tried for my Kindle Fire, theMoshi iVisor AG Screen Protection for Kindle Fire (Anti-Glare) - Bubble Free Installation (will not fit HD or HDX models)was the best. It was the easiest to install, was bubble-free, and worked relatively well touch-wise although some of the Fire's sensitivity suffered when it was in place. I can't say that about the other protectors I tried. All of those that were a film without an edge were a PITB to install and never worked well.When I got my Kindle Paperwhite, I wanted to get a Moshi product again, but I was worried that just a thin film sheet (like this one is) would be as difficult and problematic to install as some of the screen protective products I'd tried before I went with the Moshi iVisor.I followed the installation instructions and did not have any difficulty installing this AirFoil screen protector. It was easy to get it started going on straight, and after that it was a piece of cake. The cleaning step is crucial for a good experience. I did wind up with a small speck of dust underneath the top edge of the AirFoil that I could not manage to get out, but it's not at all visible when the Paperwhite is on. I don't think it's likely to pull away from the Kindle screen. The instructions say you can slide the protector without having to remove it if you get it installed a bit off-kilter, but mine went on absolutely straight on the first try.The best part of this Moshi AirFoil is the sensitivity. I think it's even better with the AirFoil in place than it was without any protector on my Paperwhite. It's almost like not having anything at all on the screen. And, because I have a puppy who is always bouncing up into my lap, I feel safer with some protection on the screen.",5.0
"This story was too short to really judge it. I really wanted the author to develop the characters a little bit more next time. However, I found the story to be creative and unique.",3.0
"The coping, the not knowing it must be impossible. The author provided a glimpse of what military families go through with deployments. But the homecoming, wow she made it hot. Can't wait to see where this goes...",3.0
"She's really developing the characters. I'm starting to like her writing more and more, my only complaint is the way she ends a book. No winding down the story line, not even a cliff hanger, it just ENDS lol and leaves you hanging! I can't wait for part 3 !!!",4.0
"Michelle Dennis Evans shares a collection of amazing photographs to illustrate her thoughts in the form of wonderful poetry, in Life Inspired. This gift book is beautiful enough to grace any coffee table.  Restful, inspirational are just two of the descriptors I would use when talking about thie poetry. Inside. The author uses nature as a way to point people toward the Creator. A wonderful little book, a beautiful gift to give anyone for any occasion.",4.0
"This book has . ups,downs, highs and lows, but the love remains strong and true.Both lovers create their own problems, and in the end all is well.A great book, and one that keeps your interest from page 1 to the end...Victoria did a super job, I loved it YOU will too..",5.0
Good follow up to the other books. Read all three and was sorry they ended. Wanted more. felt the concept was quite different and how they managed to survive.,4.0
"I chose thus rating because some of the stories was better than others, some had vivid description and some didn't. I still enjoyed reading this book.",4.0
