review,rating
"Can a simple midnight breakfast after a rescue change all that, can a chance meeting two broken souls?There are times when you pick up a book and expect to get one thing and you get another. Usually you expect a great read to be left wanting. This is not the case here at all. I had City Knight on my Nook for a bit, always intending to read it, I do love a good Rent Boy story, but last night I finally did. What I expected was a good read before bed, what I got? What I got was me in tears at 2% into the book and literally hugging myself to get through the few paragraphs of back stories for these men. 2% in...there is only one other author out there who has set me on my ass as firmly. Mr. Webb, you are in mighty fine company on my shelf.City Knight is a short read, only 50 pages in length but what the author delivers is nothing short of brilliance. You are instantly drawn into the characters of Ben and Marcus. You get to know them within a few pages; you want to know more about them, about their past that has left them broken and you want them to heal.Ben is a college student, working nights to pay his way through school. Marcus is an ex-cop, keeping a promise to make his neighborhood safe. On a cold night when things turn bad, the men meet face to face in the darkness and in each other look to find a light.I won't go into much detail about the story, it's too short for that and, well, I don't do the whole spoiler deal but...Let me gush a minute about the writing of this story, it's simply fantastic. There is no telling the reader what they are going to feel, you are sucked in from the first word and you are there. You feel it; the cold, want, hurt, loss and longing. The words flow freely off the page and into your soul. There aren't many books that I can say that about. Sure, there are book that make you feel but to get so much emotion in very little pages...that folks is talent. I am in awe, my jaw is on the floor after reading this for a few reasons but the beauty of words strung together to make my heart race, yeah...this is a work of art.""He snapped out of his reverie when a cold hand grasped his, fingers curling around his palm. Marcus looked up, surprised, into a knowing gaze. The kid's eyes were gentle, all that hot anger and spice gone and replaced with kindness and...understanding. He let the moment stretch on, only because there was no trace of pity or sympathy and Benjamin - he couldn't call anyone who gave him this without asking questions kid now - squeezed once more before leaning back.""Marcus and Ben, their stories are heart wrenching, their meeting is special and their story is just beginning. I have to say, this is a MUST READ BOOK. Regardless of gender of the main characters, this writing is something that should not be missed.",5.0
"This was a sweet & easy to read story.  It was a bit too short.  I was close to giving it 4 stars but something about the ending didn't seem right.Wyatt returns home after 12 years to his family.  He runs into Paige, his best friend in high school.  He promised to take her with him when he left but he blew town and never called or contacted her.  He returns, his mom is the only happy person to see him.  He tries to set the record straight about a car accident when he was 18 years old between him & his brother which was the reason he left town.  this was the reason the whole town thinks he is a bad boy and the reason he left home never to look back.  This was the better part of the story, Wyatt trying to set the record straight.  Once you hear Wyatts side, his fathers side and his older brother Jay side, there were a lot of emotions and I honestly felt bad for all 3 of them.  This had a lot of potential to be a nice novel.What I didn't like was I felt no passion between Wyatt and Paige.  Yes they said they once had a crush on each other and yes they shared a kiss, but then next thing you know she is asking him to move back home.  Then it ended with a HEA but there was no passion felt, no sweep you off your feet, lovemaking, no romance.  No past emotions came into play.  This is why I am giving it 3 stars.  I will keep my eye out for the rest of the series and hope the following books are longer.",3.0
"After their battle in the castle near Perpignon, Txema (Chee-ma) Ybarra and her five vampire protectors are seeking a safe haven. Txema's life has not been in her own control since the night she woke up in her University of Tennessee dorm room to find a vampire standing over her. That had been the beginning of what the world now refers to as the infamous ""Knoxville Tragedy"". (Story told in the previous title, The Vampires' Last Lover.) Txema is the last of a bloodline that is vital in keeping an entire breed of vampires from deteriorating into an army of Nosferatu-like vampires.Thanks to a recent ceremony, Txema is pregnant. During the early stage of the pregnancy, Txema and her vampire protectors are guests at the Palace of Xu Zheng in the Himalayas. However, the army of the demon vampire, Ralu Izcacus, has grown. Bent on wiping out Txema's heritage, Ralu has stepped up his attacks and his mercenaries seem to be everywhere. The aggressive attacks result in Txema having to be whisked away from her Chinese hosts and into seclusion until her daughter, Alaia (A-lee-yah), is born.Ralu will not be satisfied until he takes over the entire world. The only threats to Ralu's full conquest of all vampires and human beings are Txema and Alaia. Ralu's forces openly chase Txema and Alaia all over the globe, killing humans and vampires alike. All major countries, and many small ones, are already under Marshall Law until the ""Chupacabra menace"" is over.Amid all of the violence and craziness going on in her life, Txema's undead protectors are doing all they can to keep mother and daughter safe, while trying to inject as much happiness as possible into their chaotic lives. Though unable to visit her parents, Txema soon has the comfort of Racco de Saint Germain's company. But Txema is unsure about resuming a relationship with the immortal, especially since it could be a distraction when her focus must remain fully on the care of her daughter. And speaking of Alaia, she is developing at almost three times the speed of a normal human, physically and mentally. There are signs of Alaia having a telepathic connection with Txema, as well as possible advanced cognitive abilities.It is up to Txema's small group of allies to stay at least one step ahead of the demon vampire's welling forces, in hopes that Alaia may someday become the catalyst that heals the growing conflict between humans and vampires.**** FOUR STARS! As with the first book in this series (The Vampires' Last Lover) this story is written much like a journal or memoir. Txema is the author/narrator. As the story opens, Txema explains that she and her group are still fighting for their lives. This book picks up from where the last one left off and will tell (any future reader of her memoir) what has happened up until Txema's current point in time.The previous book/memoir covered the first two weeks of Txema's surreal adventure. This time many months are covered. Because there are months during Txema's pregnancy when nothing happens to move the plot along, Txema's writing sticks to the biggest events instead of detailing every hour or every single day. Personally, I like this. As the reader, I am not forced to wade through pages or chapters of ""fluff"" and ""filler"". The last book of this trilogy will be titled ""Blood Princesses of the Vampires"" and currently has a release date set in October 2011.Unlike the first story, there are no scenes that are too steamy or intimate. Txema does not come across as loose and she still has her trademark sarcastic disposition. Having a child seems to have matured the character a bit. Aiden James tosses a few twists and surprises to keep readers off balance. The author also injects some well known television tidbits to make the story more realistic, such as when Txema mentions missing ""True Blood"", of which I am eagerly awaiting the release of Season Four. Do not worry about cliff-hanger endings. Though this story does not tie up all loose strings, it comes to a halt at a very good spot. If nothing else, I have learned that anything that comes from the imagination of Aiden James is sure to be interesting, suspenseful, and delightfully demonic. ****Reviewed by Detra Fitch of Huntress Reviews.",4.0
After reading all Janet Evonovich books I was looking for fun read that wasn't so repetitious and had good characters. Well when I got the first one on sale I ended up getting all in this series. Love the fun and her characters. Never gets dull.,5.0
"The Wheat Free Solution (Vol. 1): Low Cost, Easy Recipes to Lose Weight and Regain Your Vitality by Morgan White brings to light some of the negative affects of including wheat products in your diet and only now are nutrition advocates discovering how eliminating gluten from one&#8217;s plate can actually increase your vitality and allow you to lose weight more freely.  If you are struggling with losing weight I recommend this book.  I was sold within the first couple of pages and the added bonus are the fantastic recipes included.  Well put together book!",5.0
"I read these stories as separate novellas before this boxed set was available and I really enjoyed them. These are sweet contemporary romances that are also fun and sexy stories. I liked the characters and the chemistry between them. I felt for them and was satisfied with the endings. One of the stories really is reminiscent of Cinderella so I see where the author got the name for the boxed set. I don't always want dark suspenseful angst filled romances, it's nice to be entertained by something light every so often and these stories fulfilled that desire for me. I recommend this.",4.0
I love me some Julia Kent. I can't get enough of her... I think I have a girl crush! Her writing is fantastic. I had to get this book again for free on amazon just to write another post! I already have all her books on my Nook! You will not be disappointed with any of her books.,5.0
You had me at Kristen Ashley! I love her alpha male characters & in this Colorado Mountain series she doesn't ever disappoint. Some things are of great beauty & only turning of the dials brings more. This story starts strong fast & it keeps pace. It doesn't have all of the high impact suspense of some of the others but it does carry enough drama.,4.0
I am sorry but this was not done very well the author kept getting names mixed up and each new volumes chapters were repeated over and over know that I will never purchase a Sicily yoder book ever again!,1.0
"H.P. Mallory writes the best series.  Love this book about Lily, Talis and Bill the Angel.  it was humorous, suspenseful, and exciting.  I'm hoping Lily and Tallis get  together, he sounds hoot.  highly recommend.",5.0
"I enjoyed reading this book, and as someone who has worked on the floor and as a training supervisor for the Department of Health in a Southwestern State, I can tell you that many adults do not practice most of these steps, and many youth have no idea. I did find that the author making a very true statement, that people should drink 8 oz of water or more a day. I actually think the recommendation is more like 80 oz but that is more than 8. hahah  Something like this is not at all something to criticize a booklet for. I'm glad to have read this book and have it for a resource.",4.0
"OMG I love Drew Evans...while it was a short story it definitely was great and left me wanting so much more of Drew..In my opinion your books are the best of a male's POV I have read yet...I loved Tangled, I loved this book, and can't wait to read more about Drew in the near future... Thank you for sharing Drew Evans with us....",5.0
I'm still using this ebook as a reference for book description tricks. Love it! Very knowledgeable author who also happens to offer various online tools. Get this ebook!,5.0
"I was pleasantly surprised by this book. While reading what it was about I figured typical, the guy will seek revenge, he'll fall back in love with her, and everything will be alright.OF course I was right but it was so much more than that. Lukas and Jasmine had met a few months ago and basically love at first sight happened. They had a whirlwind romance and gotten married. But thanks to a decision to be separated right after their wedding due to business, a critical accident, an interfering father, and amnesia Jasmine doesn't remember Lukas and anything about their relationship. She knows she's married but she's confused why he has left her. Did she leave him? Did something happened? ALl she knows is that when she wears her rings she's calmer and knows something is missing.Lukas is planning his revenge. Jasmine hurt him in the worst way possible and her father loved shoving it in his face. Now months have gone by and he wants what's his and then to get his revenge. However there is a few details he doesn't fully think about. WHat happens if she actually has amnesia? and what happens when everything he thought was true wasn't? That is why you need to read this book. It was seriously heart gripping and hard to put down.",5.0
"A last minute impromptu stop here turned out to be a life-changing experience.  The cases are filled with tempting treats, including cupcakes, cakes, pastries, cookies, and more.  We ordered a sugar cookie, a scone, a cupcake, a blondie, and a meringue cookie.  The sugar cookie was in the shape of a unicorn and tasted delightfully buttery and not too sweet.  The scone was packed with dried fruit and had just the right amount of crispness and richness.  The cupcake was a rendition of hot chocolate (their flavors range from ordinary to quirky to truly original).  The frosting actually tasted like a steaming mug of hot chocolate, while being light and fluffy at the same time.  The cake was one of the best cupcakes I've ever tasted.  Super light and yet very chocolatey.  I don't find cupcakes I like very often, as I find most of them to be sickeningly sweet, chemical-laden, or just lacking in flavor and texture.  This one was truly a standout and I enjoyed every bite.  I gave the lime cheesecake blondie to a friend and will inquire about its merits, but based on everything else we sampled, my guess is that it is on par.  The final selection, a purple and blue swirled meringue cookie (appropriately called ""unicorn poop"") was exactly right.  Even though I'm hardly ever in that neighborhood, I was so pleased with the quality of the food and the adorable storefront that I will make an effort to return, hopefully time and time again.  Highly recommend!",5.0
"My husband and I had an excellent dinner. There were many cream sauces on the menu which we don't care for but we were able to modify the sauce.  The only reason I don't give five stars is that the limoncello cake is a huge disappointment. It's not cake, it is a little fried thing.   Our waiter was prompt and friendly.",4.0
Shocked! That is the best way to describe this first book in the Crossfire trilogy. It moved along a little slowly. But kept me interested throughout!Worth it!,5.0
"Jocelynn Drake gives us our first look into her new Urban Fantasy world of the Asylum Tales with this engaging novella. Our main character is Gage, a tattoo artist and wielder of magic, who shares his story in the first-person.  It all begins as he wakes up on the floor of a nasty bar bathroom, shaking off the effects of a mickey.He soon discovers he was drugged by his own friend, an incubus named Parker, who dosed him so he could go, er, recharge his energies.  A troll named Bronx helps him track down his wayward friend. After too many drinks together, the three of them engineer a misguided plan to give Parker a magical tat to help him get the energies he needs without having to cheat on his girl.  Things only go downhill from there.I liked the story.  The world-building is clear and easy to understand... and incorporated seamlessly into the storytelling.  Even in roughly 60 pages, Drake gives us a clear look at her protagonist and the ongoing problems he will face as he struggles to suppress his magical urges and duck the close eye of the Ivory Tower council.I look forward to getting to know him better and I hope we see more of secondary characters Parker and Bronx. I have a feeling we're in for a fun ride with this series.Rating: B+",4.0
"Interesting book! The manipulation techniques caught my attention and I would absolutely give it a try.This book is perfect for me because I am in sales, will wait and see how my persuasion skills go! Fingers crossed!",5.0
"I was looking for somewhere new to grab dinner and a beer when I'm too lazy to cook, and read about this new Fishtown spot via Twitter.  Suddenly what I really wanted was a burger and a scotch.  I decided to trek through the first snow/sleet/nastiness of the season to check it out.

After reading up on the brand new bar, I was hoping for ""Village Whiskey, Fishtown Edition"" and that is exactly what I got.  No, they don't have 50 single malt scotches on the menu.  But the do have close to 10, at a big discount from Village Whiskey's prices.  And they have my personal favorite scotch -- Laphroaig 10yr -- which I enjoyed with an excellent burger. (It's not really fair to compare to the Village Whiskey burger, which is arguably the best burger in the city, so I won't.)

Overall, my first visit was excellent, and I will most likely find myself there again every time someone I've shared a drink with at Village Whiskey is in my neighborhood.",4.0
I was hoping for a bit more in the story department at times I felt as if I was only being told part of the story. The characters are likable and I thought the romance was hot but the ending kind of fell flat too me because it was to predictable. oh well maybe Ms. Dubois will expand on the series and give us a little more action and adventure and less inner monolgue,3.0
Nowhere in the description does this say this is a short story so would not have spent my money on this and it wasn't that good.I am an avid reader and this was a waste of time and money.,1.0
Lubrican's story always entertains and make me laugh. This one is a keeper. He never fails to deliver. Worth the money.,5.0
"The plot was great, and was well written. Although I guessed who the murderer was early, I was not certain until cv lose to the end.",5.0
"A short and cute story, historical blended romance novel. The author could have made the story longer. I would buy from this author again.",4.0
"I am a relatively new fan of Carrie Ann Ryan and have been waiting for Adam and Bay's story from the fist Redwood Pack's book and I was not let down! This book was such a tear jerker, full of emotion, anger, battles and above all true love. I never give a story away but this one was so worth the wait I cant even begin to tell you how much I loved it. I bought and read it in one day-it was that engaging. I will no doubt be re-reading it to make sure I did not miss anything! Cant wait until the next book in this series!",5.0
"Wow! I absolutely love this book. I think we have forgotten how to communicate especially in the work environment. However, I think the chapter about communication skills for married couples is my favorite. This book even has tips on how to communicate with your children. Excellent read!",5.0
Another story line that seems to end too soon.,5.0
Ordered the USB cable for my Kindle Fire to transfer documents from my computer to the Kindle Fire for travel purposes. The cable worked great and I was able to transfer several books along with the documents. Good purchase.,5.0
"Near death when rescued, Noah has spent the past six months recovering from his year long ordeal.  He was caged, brutalized, and assaulted on a regular basis by the Raven who made Noah call him Master. Noah still can't sleep most nights.  It doesn't really help his morale either to be treated with kid gloves by his entire family, plus he knows intuitively that they are keeping information from him.Seth still recalls the night he kicked in the cage door and found the young jaguar shifter beaten half to death.  He carried Noah to safety and remembers how perfectly he felt in his arms.  A connection was made that awful night, somehow felt by both and never forgotten, no matter how long they've been apart.As brother to the shifter coalition leader and part of a large shifter family, Noah should feel something besides constant isolation and loneliness. Yet, Noah has never felt more alone.  Could it be that everyone knows of his past? How he survived on the streets or is it the treatment by his captor that makes them shy away?  It seems to Noah that nobody will ever love him, especially a tall, hot tiger shifter named Seth.A perfect balance of steamy romance and heartbreaking perseverance, A Wicked Caress is memorable.  Book five in the Lost Shifters series, A Wicked Caress has just enough back story to put this tale in proper perspective for new readers without boring the many, many fans.  Noah's life has been a tragedy, but he's a true survivor while Seth has also dealt with personal anguish.  These two are meant to heal each other, together.  There is a strong sensual element that tantalizes the senses as well.  A Wicked Caress is an erotic adventure certain to please readers.  My only regret is that there's only one missing brother left to find. I don't want this series to end.LisaReviewed for Joyfully Reviewed",5.0
I really loved this book!!  I had a hard time putting it down once I started it. I enjoyed the first book in the series but I enjoyed this one so much more. Zoe is one of my favorite book heroines! She was such a strong character and wasn't afraid to say what was on her mind. I did get a little irritated with Alex and the back & forth stuff. I could kinda see why he was doing what he was but it still irritated me. I love that these two characters got their HEA and can't wait to read the next book in the series. I hope we get more Alex and Zoe.I received a free copy if this book in exchange for an honest review.,4.0
"You will definitely need eye drops to keep reading this book. It's a DONT put down, stay up all night-with the lights on- type book. Well thought out plot. The title really doesn't make sense until almost the end and then you go &#34; Ah yes now I see it&#34;If you're into a good read make sure you have plenty of time and no interruptions.",5.0
"This is a great book for anyone having difficulty getting over an ex. It is very enlightening in getting you to embrace the situation in order to learn and grow from it, Very comforting and highly recommended!",5.0
"There is nothing sweeter than an unrequited love being fulfilled between two phenomenal people. Bring the heat and it's on. I was happily surprised to be so drawn in by this story since I'm a straight female. True sign of a great writer, attracting unsuspecting fans.",5.0
"Ok....I'm hooked! Certainly will be moving on to the next book-scratch that-the rest of the books in this series, as well as any others from this author! I love the way she thinks!",5.0
"This collection has a little bit of everything. A little mystery, a little intrigue, a little danger, a little heartbreak. There is, however, a lot of love and happy endings. I recommend this collection to anyone who wants an easy read of feel good stories centered around the Christmas season.",4.0
"Whisk is absolutely adorable! I moved away from St. Louis a number of years ago, however, when I'm in town I definitely make it a point to stop by here. The baked goods are delicious, the atmosphere is wonderful, and the owner is extremely nice. Being from Seattle there is a sustainable bakeshop within a few blocks of almost everywhere, and now I'm glad that St. Louis now has a great one. Would highly recommend a stop by Whisk next time you're in the area - you won't be disappointed!",5.0
"This is a very good short story. The stage is set well, but quickly. The children only have themselves to rely on, their parents only seem to regard them as household staff. Then you have the house next door, where the owner has recently died. A well respected teacher, who, nevertheless doesn't seem to have had anyone that close to him. Let the strange things going on begin. The story can stand on its own, but, does make you want to follow-up with at least some of these characters in ""The City.""",4.0
It was also a great read. I loved the spiritual tone to this book and how it teaches and shows ushow to be grateful for everything from the small things and big things and how to be this way every day.,5.0
The writing seemed very simplistic but the story line was good. It has made me want to continue the series to see what happens to Lily.,3.0
"this is a must for everyone.
two ways to do it.
buy reserved seating in advance cause thats the best way to enjoy this show
general admission means standing room only
small, tight, intimate, and hot.
be prepared if its a hot night cause there are some fans but its the real deal up in here.
the musicians are stellar and have a wonderful sense of humor.  playing classics and they take requests so hit that tip jar.
tshirts and beyond for sale after the show.
be prepared to wait in line.
8, 9 and 10 pm shows.
we did the nine pm.
pat O's comes out and provides drinks while you wait, or hit up johnny whites for a better drink price.  also, they sell no drinks inside only water, so be prepared and know that the focus in this place is the preservation hall jazz band.",5.0
I truly enjoyed reading this book. Story was well written. It was the first story from this Author but I will  read more from her.,4.0
