review,rating
These are some great looking smoothies. If you are serious about losing weight start using smoothies to your benefit. They allow you to consume more vegetables than you would just eating them and can use the ones with higher fruit for post workout or for a healthy breakfast. Honestly if you are too busy to eat breakfast whip up one of these shakes.,5.0
"This is more of a teen story, but I enjoyed it as well. I liked the new angle she took with the theme.",4.0
"Let me star off with; I ADORE the cover!I&#8217;ve read a lot of book about the innocent girl heading off to college with her mind set on change, and most of them have been really good and they all turn out completely different. 3:AM has a really good set up, but it&#8217;s so fixated on the sex Baya is not having it kinda overshadows the rest of story.She meets Bryson and sparks fly, but when she realizes he&#8217;s the campus player and that she has the hot&#8217;s for him everything he say is a sexual innuendo in her head. The most common, innocent sentence has her head reeling with &#8220;What did he mean? Did he mean it literally or is there a hidden meaning? Does he get a boner by just looking at me as I do him?&#8221; I get that she wants to be viewed as something else than a 15 year old little sister but it gets down right ridiculous.I almost DNF&#8217;ed it after I&#8217;ve read a quarter but Bryson and his past had me keep reading. He&#8217;s without a doubt the only thing that makes this book bearable. Well, he and Laney but she has such a small part she doesn&#8217;t make much of a difference.  Bryson is a good character, not a phenomenal one but a good and all over likable one.In the last half of the book when Baya starts looking for something else than for somebody to &#8220;defile her&#8221;  out comes a pretty okay story. It&#8217;s a bit chopped up and it all happens very fast at the end but it&#8217;s actually not that bad.",2.0
"After loving Enough Isn't Everything so much, I knew this one would be just as good. I was anxious to to read this and was not in anyway disappointed whatsoever. Everything She Needs picks up right where the first one ended.Lily is back in London for the holidays and is hoping her friends can help her mend her broken heart. She just wants to get away from the drama that has taken place during her first semester at college. She has come to terms with the things she has done wrong and doesn't want to be the person she has become lately. She is completely in love with Alfie but doesn't want all the heartache that comes with it. Lily gives into temptation and allows herself one night with Alfie and then takes off back to Miami after realizing it was a mistake.Alfie is determined to have Lily and he tries his hardest to get another chance. Alfie is trying to be honest with Lily so he makes a confession about another female and Lily has to figure out if she can deal with it. One other confession about his feelings for her will leave Lily questioning if she should push him a way or not.Lily and Will's relationship is still in a slump ever since the &#34;situation&#34; took place they seem to have lost the comfortness they once had with each other. Lily's best friend Jack from London definitely fills in the void of not having Will in her life. Jack will do whatever is in his power to make Lily feel whole again.There is a lot going on in this book, it doesn't entirely concentrate on Lily and Alfie's relationship. You meet new characters that you will love, especially Jack, who is sweet, hot, and witty. Lily develops into a more mature young women focusing on her studies and music. Something is always getting in the way of Lily and Alfie having an actually relationship, keeping them from having their HEA. I was so jealous of Lily, I might take the broken heart if I could be surrounded by as many swoon-worthy men as her. I loved this book just as much as the first one and I am hoping that Lily and Alfie can get their HEA in the final book. Highly recommend.",5.0
"A fantastic novel!  It is a little slow in the middle but delivers non-stop action from middle to end, with edge-of-your-seat thrills and gripping discoveries.  This is a very well-crafted story, minus some filler story, and I couldn't wait to read more.  There are more questions to be answered and more adventures to be had with this series.  Can't wait to read more!",5.0
"The price of food seems to be constantly on the rise, so who would not benefit from some useful tips on how to save money on feeding a family.This easy to read book explains how to save money in many different areas: Food shopping, food preparation, where to find coupons, how to save when eating out and even a section on being self sufficient.Included in each section are some useful resources where you can find even more information. Well thought out and put together.* I noticed some of the reviews mentioned poor spelling and grammar. I think this has been rectified as I did not notice any myself.",4.0
"This was an excellent non-denominational Christian novel. I truly enjoyed reading about the different characters struggles and how their lives were touched by others doing their best to be instruments of God. There were a few typos, but they only briefly interrupted the reading.",5.0
"One of the only places my fianc and I frequent. (He's a great chef). Good food, great price. Not always great service, but more often then not. A hidden gem in New Orleans",5.0
I loved her book Price of A Kiss and had high hopes for this book as well. Linda Kage did not disappoint. I absolutely adored it.,5.0
"The Dazzling Darkness by Paula Cappa is a wonderful supernatural thriller set in the woods of Thoreau, Dickerson and Alcott.  Where the ghosts of these authors still haunt the pathways and ponds with their teachings and art.When young Henry Brooke fails to return home from school, the entire town turns out to help search.  The last anyone had seen of him was on the cowpath near the old cemetery, where he was playing follow the leader with his sister.  Now, there is nothing...But, the dogs pick up his scent in the cemetery, leading nowhere.  And his voice is heard in the tree outside his house, but he cannot be found.Is he lost in the woods, alone?  Has he been kidnapped by someone who has learned of the money that his father's family has?  Or is something far, far more sinister at work here?Ms. Cappa weaves a tale with a veritable maze of twists and turns, full character development, and believable investigations.  The answers that the family finally find are heart wrenching, and heart warming.  Very enjoyable read.",5.0
"We have a contender for best wings in Ardmore. Went for late night get together not long ago, haven't been since it was a maloneys, it's hard to believe it is the same bar. Nice and updated restaurant. Haven't tried the pizza yet, but the wings were great. They had the crispy exterior I love in wings, no mushy skin on these.",5.0
"Death Rites - Hawaiian Bad SpiritsRating: 4 of 5Author: D.V. BerkomFormat: KindleAfter narrowly escaping death in Alaska, Kate Jones finds herself again on the run.  Unfortunately, bad spirits have a tendency to find her wherever she goes and soon, death follows her once more.  But something is different, and those who are after her are out for something much different than money or revenge and Kate suddenly finds her world and all she knows turned upside down.In this installment of the series, Berkom introduces a bit of a twist in the Kate Jones series.  I'm reluctant to give away too much of the plot line but lets say I think that this deviation from the Jones formula was a nice surprise which added mystery elements to her patented action movie style writing.  I do feel sorry for poor Kate who is definitely a magnet for bad luck. I don't think her life will ever slow down!Fans of the series will enjoy this chapter of the story.  Next up is Touring for Death. Well have to see what trouble Kate gets herself this time!  Always a great bargain on Kindle, download a sample and I'm sure you'll get pulled in to the Kate Jones adventures!Note: A complimentary copy of this work was provided in return for a review",4.0
"I'm a music lover, and even I learned a few things from glancing over this book. Music is a complex form of art, and in a few short pages, it explains the history and culture of music, all for little kids to read. Any kid should learn about music, and this is a good way to start.",5.0
"Faith has once again exhibited her versatility as an author. In ""On Christmas Hill. (A Seasonal Affair)Faith captured me with the title. ""Hmm, an affair during Christmas,"" were my first thoughts. Was not that type of an affair, even better.  Romantic! Emotional! Faith expounds upon the determined life of Catherine, a female postal employee who happens upon a ""lost"" love letter. Catherine, not your atypical postal person, is determined the letter finally reach its intended destination and a whole new world opens for Catherine. She has been ""used, abused, and dumped,"" unlucky in love. A hearty, uplifting book. Faith has that talent to draw you into her characters. As a reader you find yourself feeling their pains, their heartaches, but also, moved by their good fortune. You will be captured by all these emotions and more with this descriptive, heartfelt book. She skillfully brings a new love into Catherine's life, but not without the insecurity, the baggage of distrust, which we as humans involved in life, carry from one ""love"" to another.",5.0
Thank you so much Mark for writing this book and teaching how us authors can use Amazon SEO to our best advantage. There are always so many things to learn when you are a new author and trying to make a name for yourself and definitely having your books found by people is so important to building a profitable business. This is a complete step by step guide that walks you through everything you need to know when you are starting out. Great Job. I recommend this book to anyone who is new to publishing on Kindle.,5.0
"The best Chicago style pizza I have ever had. That's right, you heard me Chicagoans: the best. The pepper sauce is outstanding, the crust is delicious, and the atmosphere is a blast. It does take about 45 minutes to get a pie, but if you go either early (before 7) or late (I think they're still cooking after 10) it's not too bad.

If I could have packed the Black Thorn up and took it with when we moved to Minneapolis, I would have.",5.0
Leslie Kelly writes a good book.  I especially enjoyed the couple enjoying themselves.  This is a sweet and sexy book.  They say you can't go back.  This couple did.,5.0
"I really cant wait until Part 2 of this book comes out it was a great read ,Read it in about 2 hours i really njoy a great book and this is one HAPPY READING!!!!!!",5.0
"The food is quite good (and at a lower price than other, similar popular brunch spots in philly). The stuffed french toast, smoothies, and fries were all delicious. The wait is usually a bit long b/c seating is very limited.",4.0
Erotically romantic with a story line that feels like home! Life is full of hard decision and some time it even gets in the way. Find out what a strong woman can do for a strong prideful man. Hold on because this is one roller coaster ride you will not want to miss. Lose yourself on this road to love!,4.0
"I got pulled in by the description of this book and I've always enjoyed stories written by Lynn Richards, so I was hoping it wouldn't disappoint and it most certainly didn't!! The chemistry between the H/h is off the charts and the story is great, not to mention I LOVED the HEA!!! I hope we see Briggs' story soon!!",5.0
"Not exactly a romance novel, this is more of a starting over story - stories.  Each of the three focused characters in this novel come to the end of a road, and bravely begin again.  The primary character is a New York City fortieth widow who returns to the hometown of he deceased husband, and struggles to turn a large house into a bed and breakfast.",3.0
Very enjoyable book partially dealing with keeping secrets. For awhile there I thought that it was going to follow the norm about not revealing &#34;the&#34; secret - so much so that I very nearly stopped reading. I just get tired of the lead characters in a book being so stupid. This straightened up and actually became more &#34;real.&#34;,4.0
This girl can't catch a break poor girl. And that nasty mother of hers wow that's all I can say. can't wait for part two. great bood,5.0
"Napoleon&#8217;s police, called the &#34;Infernal Machine&#34; provide the reader with interesting characters and an intriguing plot. An assassination attempt against Napoleon fails, but kills many French citizens. An onlooker who became a witness also became a member of the police investigating the crime. By chance, he saw the bombers as they rushed from the scene, thus found himself not only a police agent investigating the bombing, but an eye-witness that produced apt depictions with the help of an artist. Police work without any touches of technology that we enjoy today was dull and tedious, but the tightly written story entertains. Thoroughly enjoyable.",5.0
I loved this story! Cade it super hot but he pissed me off 2. I can't wait for the next book in the series.,5.0
"3.5 StarsThis is one of those book where I liked both the characters and who they are at this point in their lives. I like their situation and what brought them together at this point in time, but what disturbs me is the inability to get over, get past stuff that happened 9 years ago when they were in high school. I&#8217;m sorry but I&#8217;m very much a believer that when something in your life goes wrong you deal with it and move or you get therapy and figure out. People carry too much baggage around and let it impact their lives today; it&#8217;s not healthy and at times it&#8217;s just flat out childish. So, while I enjoyed Kiss Me At Midnight I didn&#8217;t love it because both characters were too hung up on what happened in high school making them both appear somewhat immature for the responsible adults they both are suppose to be.Ashley Hanes and Ethan Pierce were best friends in high school until one day Ethan refused to talk or do anything with Ashley anymore. She&#8217;s never quite gotten over the rejection. Ethan&#8217;s young heart was shattered when he saw Ashley kissing another boy when he had finally made up his mind to pursue her and tell her how he felt. Cutting off all communication was like cutting out a piece of his heart but he did it and he moved on and away as fast as he could. When they meet nine years later on New Year&#8217;s Eve thing get very interesting, very quickly.It was easy to like both Ashley and Ethan; they both have accomplished a great deal in their lives and are happy and productive. However, they have this history that neither one of them can seem to let go. One thing that is quite evident is the steamy chemistry circling around them. There is no denying they want each other and decide to spend one night getting each other out of their system while Ethan is in town for the holidays. I enjoyed their time together and the way they worked through their past issues and rediscovered each other as adults. The obvious friendship they had is still present but soon they both realize feelings they didn&#8217;t want creeping in and causing some confrontations and hurtful verbal exchanges.I enjoyed this story but I think it could have been so much better had the characters not been so caught up in the past. Neither one seemed to want to focus on what they have accomplished; they were more interested in dredging up the past over and over. A good read that could have been so much better.Review copy provided for an honest review.",3.0
"I wasn't a fan. I was looking for a book that would give me some information about how to improve my writing, but mostly any tips that were given were overly hashed ideas that really didn't add anything new to what I already knew. In addition, I really didn't like his attempts at humor.",2.0
"Contrived, pathetic, hard to follow. The author find a phase he likes and repeats it to the point of distraction. I would have also liked a few clues as to why the murders were happening. This was just a bunch of stumbling around in the dark. But the biggest problem I have with this book it why no one thought to break a window to get out. Come on people.",2.0
"Great story. Really getting into it and it ended.  I highly recommend all of Max's books. Great stories, and not afraid to have real men for characters. Hairy, Sweaty, jock strap clad men....",5.0
"This continuation of the Beautiful Series finds the main characters, Lily and Kyle, selling her home in Colorado and moving on with her life. She moves into Kyle's home in California and she seems to be handling the passing of her family, but Kyle still has some secrets that he has yet to share with Lily. They start to begin their lives together, plan for the future, and it all wraps up like a typical fairy tale, happily ever after.This series was very easy to read, the characters grabbed my attention and who doesn't love a happily ever after story? I hope to read more by Alicia Rae in the future.",4.0
"I read this short after reading Angel Unborn in Malice, Mischief and Men. I was totally hooked.  It overlaps Angel Unborn' s end, telling the story from the H' s pov--giving additional depth to the story and quenching my curiosity about what happened on the other side.  I have bought the next book, Angel Unleashed, and have a feeling I am going to be looking for a preorder button for the next one. It's not often I find the magical combination of humor, suspense, and engagement leading to the ""I can't put it down"" response. Andris Bear brings it with this series.",5.0
"Blood Iris is a dark collection of well written tales from some of the newest and freshest voices in the genre.  From Annie Bellet's  'Til Human Voices Wake Us which presents a psychic with secret to the utterly delightful tale of an elderly witch in ""Monkey Business"" by Elle Casey all the way through to the dark and disturbingly beautiful vampire love story by SM Reine ""Monsters"".  The stories in between will make you want for more - particularly ""Mama's sword"" by Ada Hoffmann.  ""The door in Red Hook "" By Joshua Grover-David Patterson will leave you eyeballing random doorways and wondering.  There are many more tales, all full of merit and while I can't say I adored every story, I will admit that they were all well written and held my interest until the end.  Not something I can say about most anthologies.",5.0
"I don't usually like ebook downloads that contain a short story and a longer promo; I usually find them to be a tactless way of pushing the reader to go buy something else by the author.  However, the short story included in this download was actually a very nice length, and I surprisingly thought that the promo fit well into the download, almost continuing the short story in a way.The short story follows Garrison Gage as he is asked by a teenage neighbor he doesn't really know to investigate the disappearance of this teen neighbor's girlfriend.  Mr. Gage unwillingly agrees and starts to get back into investigation, something he had given up long before.It's a really nice intro to the Garrison Gage series, and it was so well-written that it didn't feel rushed or too short at all.  I loved the persona of Garrison, as he is a crippled man with a full sense of sarcasm, which was quite witty and humorous at times.The short story only takes up about 1/3 of the download, though; the other 2/3 is the first few chapters of the official Book 1 of the series.  It gives you more insight into Garrison's past and how he ended up in the town he is currently living in.  It also really does draw you in and makes you want to keep reading, something that I may just do by buying the official book.Overall, I really enjoyed this short story so much that I wanted more; and the fact that the promo for the first book was included satiated that desire.  I think this shows promise as a mystery series, and I can't wait to see what the author does next!  I highly recommend checking out this short story, because I really enjoyed the mystery.Warnings - Language, Mild Sexual Violence References; Mild Violence",5.0
"Well done on so many levels!! In highly impressed by your writing the characters that cuddled up to my heart almost instantly. Was nervous for both Millie and Claire the whole book, but truly an awesome, beautiful and heart filling ending. Thank you Tara for sharing your gift with masses. Both my mom loved it and my sister is about 45% through. You've touched my entire family with this book and I read and finished your  book in less than 24 hours it was THAT GOOD!! Keep it up!!",5.0
This book was not very exciting and did have any attention grabbers. I still enjoyed it because it occupy my time before bed.,3.0
"Maddie is the wife of LAPD Detective Jack Ramirez. She and her BFF decide to shop for an anniversary present and head to an adult toy store. That's where they find the body. We follow their zany and humorous detective efforts in a comedic romp. Nicely written, nice plot and great cast of characters. Short story but good reading.",5.0
"This was a wonderful mystery=thriller in this series. I would recommend this book to anybody whom loves to read mystery thrillers, another great book by Claude Bouchard.",5.0
I really enjoyed this story. Garrick and Savannah were great characters. She is a tough woman who loves her job and I love that the author let her be human also. Not always the tough broad. Garrick is also a wonderful character. So full of feelings of love and protectiveness. And the storyline about Bobby Kramer and his dad was great. A dark element in a story is wonderful. I loved feeling the heat and love between Garrick and Savannah.,4.0
Very riveting . Kept me intrigued the whole book. Will get the next book for sure.Think everyone should read this,5.0
"You know I love Mary Calmes and I know what I am getting with her,  but this story didn't quite work for me.I loved both the men, who are standard Mary Calmes types - Weber,  the drifter/cowboy/bull rider and Cyrus, or Doc, the charming,  slighter, more openly gay man.  I liked the opening chapters a lot,  but everyone just loved Weber way too much,  and it all felt a bit too perfect for me...  I know she writes fairy tales, but in this one I couldn't suspend my disbelief long enough.  I've read lots of her books and will read more... but this one wasn't a hit for me.",3.0
Good book with certainty enough action any one character could ever have. Had a he ending but guided towards it less not being a big surprise.,4.0
"Oddly enough this is a decent location. Free multi floor parking was a plus in case of flooding. It has a decent gym, and a nice upstairs pool. Relatively easy on-off highway. A $14 Lyft to French Quarter's canal street. Concierge is minimalistic and oddly located in open area in front of elevators. I like the elevator key lock to the top floor.  
But for some weird reason the prices in late October are rising above French Quarters, which I presume is a micro-market in Met'ree (that how they say Metairie ;-))",3.0
I am not pleased with this Rouse's. The staff could be a little more helpful. Produce could be better. Good price on Coca Cola today.,3.0
"When Alexi bails on her society wedding after finding out her fiancee cheated on her, she runs right in to old beau, Jesse Weldon. From there the romance is hot and steamy with a little mystery along the way. Look forward to reading about the other &#34;bad boy&#34; Weldon brothers.",4.0
"I really don't know what to say about Arianna Rose, except that it was AWESOME. I honestly couldn't put it down.",5.0
This book was not what it was hyped up to be. There were times I couldn't get past a certain sentence because of grammatical errors. The thought the reason for waiting on the book was because it was being edited? I gave it 2 stars because it did start off good but I got lost in the middle. I guess because the story line of certain characters I didn't care for and those characters to me didn't make sense in the book. The first book was soooooo good! Maybe April need to team up with Aletha again to make book 3 better!,2.0
A very sweet and short story.I enjoyed reading and am very much looking forward to the next Bayou Heat book. Can't wait :),5.0
Not as good as the first three but interesting and had several twists I didn't pick up on. Good book the author has a vivid imagination. Go for it u will not be disappointed.,4.0
I wasn't sure I was going to like this book when I first started it but I could not put it down and sat and finished it in one sitting.  I cannot wait to get the rest of the series. This is a really good book.,5.0
"One of my favorite sets from Maggie Shayne. Love the way the books tell the story of the past lives as well as keeping the current lives so exciting. A vary &#34;hard-to-put-down&#34; set, once you start, you'll want to keep going til you are done :)",5.0
