review,rating
It was hard to wrap my head around a hero who is six foot eleven tall!  No pun intended.  Just didn't work for me and I won't be buying the rest of the series.,3.0
"Damn, I enjoyed the blurb so much I'm giving it a premature, provisional 5 Stars.I definitely want to know how to write a threatening introduction. (Fair warning: If there are no practical techniques offered by PPIII, I'm going to revise my review to a snarling, 1-star hate-fest that states, in part, his bow tie must've cut off circulation to his brain, etc.)Thank you for providing a timely how-to on a vexing issue that the self-published face today. (Unless you haven't. In which case, I'll be opening a can of verbal whoop-ass on you, buster.)",5.0
I enjoyed the storyline but I believe that it could have been better. The concept for this series had huge potential but I think the quick and racy sex scenes took over. I hope the second book in the series will be more to do with the storyline concept.,4.0
"Received book free of charge from the Author for an honest review.Ethan has been plagued with dreams of his colleague, David. Not just everyday regular dreams either. Erotic dreams that are keeping him on edge. David has been attracted to Ethan for awhile and has been biding his time. That is until they find themselves stranded and he notices the heated looks being sent his way. David is determined to loosen Ethan up, if he will let him. Ethan is nervous, but he doesn't fight the attraction he feels for David.It's not about sexual orientation it's about the touch of another person. Neither man is gay, but what they find together is beautiful and something worth exploring.Let's just say that these two men bring out the beast in the other and WOW it was HOT!! Then when a third was brought in it just got that much hotter. I really enjoyed this book and recommend it for anyone who likes to read graphic erotica.Yep, I'm giving it 5 HOT Stars!!!",5.0
"A fast-paced, sexy, emotional and sometimes tender romp through the damaged psyche of two men who complement each other through their own flaws and deep desires.Dominic Scotto is heartbroken, having walked in on his lover with another man. A man he'd thought was out of his boyfriend Wes' life for good. Then things get even worse. He's knocked unconscious and wakes up bound to a chair with what looks a psychopath ready to carve him up.Smoke is an assassin--a very well-placed, well-respected assassin, but still a killer. And Dominic is his next target. Smoke wants some answers from Dominic about his father's empire and he's no averse to using violence and coercion to get them. But the son of the father has nothing to give. Instead he has to watch as he's slowly cut and sliced by Smoke in his efforts to draw out what he wants to know.Then things get a little...awkward. Smoke begins to realize that Dominic isn't all that averse to the torture he's inflicting, and in fact, it's having quite an effect on the young man. From that point on, things spiral out of control, certainly out of Smoke's as he struggles to come to terms with the conflicting feelings he has for Dominic.It's gritty, sexy and violent in some parts, as the two men face each other down, both with their own needs and desires, hot passion flaring and taking over as the walls each have built around themselves come tumbling down.The book is written well, the characters fleshed out so that you get to understand them and what makes them tick. If you fancy a bit of violence, cruelty, family drama and justice, ending with the culmination of these two men finding each other again, then you'll love this story.Reviewed by Susan Mac Nicolfor TheRomanceReviews.com",3.0
Wonderful writing. Excellent plots. I liked all the characters in all the books. I would recommend this book to friends. I had a hard time with the last book. I am not into Kinky sex. Some parts were a bit much!,5.0
"I am a long-time reader of Lora Leigh's books, and this one was pretty good.  The plot line was predictable but I liked the interaction between Sax and Marey.  However, there is one aspect of this author's writing that I really get tired of, and that is her over-use of phrases such as ""breathed out roughly"", ""spoke roughly"", ""breathed in roughly"", ""whispered roughly"";  please, Ms. Leigh, be aware that when one word is used over and over again in books, ad nauseum, it gets really old fast!  In this particular book, I counted at least 6 times when these types of phrases were used.",3.0
"I learned about Glenn Soucy on Twitter & decided to purchase his book series.  I was skeptical at first, wondering if I would enjoy this genre.  Glenn does a good job keeping the story fresh and moving.  His character development is sound.  There are a few e-book formatting issues, but I can live with those.  Overall, I'd say Glenn is a good writer.",4.0
"I enjoy reading young adult novels even if I'm older than the perfect reader, so I was very happy when I received a complimentary copy in exchange for my review. I must admit that after a great introduction where you could get an introduction to the setting and the main character, the first chapters were a little bit difficult to read because of the language and slow events but the characters are well described and after the awkward scene of love of first sight, the novel really starts engaging the reader.The author did a great job in creating a young, strong and likable character as Thera who starts a personal journey and discovers her real powers to fight evil and lethal enemies.One of the elements I really loved was how the nature is linked to the characters: the force, the forest talking to Thera and trying to help and warn, the animal spirits... I think it was a great way to make readers thinking about our impact to the Earth and what can we do to improve the world around us.I also loved the relationship between the characters,and I always appreciate when in a Y/A novel young girls have the power to change and fight instead of just being in love or saved by their true love.I hope the sequel will be published soon to read more about Thera and the Elanraigh world as the ending arrived when I was totally enjoying the story.I'd recommend this book to everyone who loves a well written novel about magic, love, adventure and nature.",4.0
"Renee Rose has a gift when it comes to writing historical romance.  She can paint a picture that you can readily see in your mind's eye and gives you a glimpse of how things used to be.  You feel as if you are there experiencing what her characters are going through and that leads to an emotional connection.  This is a wonderful story with a strong plot and stronger characters.I loved the character of Jean-Claude, I think he was my favorite in this story.  He is surely an alpha man but there is such warmth and caring which is a huge part of his character. Corinne is surely a lucky woman.  There is some great romance and some hot sex with some well deserved discipline applied as necessary.  Well done Ms. Rose and I am sure this is one I will read again.I received this book from Stormy Night Publications as an Advanced Reader Copy. Hmmmm, I don't know why my name was changed to Amazon Customer, sheesh, but I have changed it back to SH!",5.0
"i loved the book couldn't put it down, and in the end it was the sister inlaw who had her own child killed because she couldn't have the man that she wanted all along.",5.0
"I liked this story, but I would title it something else. I get the whole reason behind the title, but James came in so late in the story that I had forgotten that he was somehow apart of it. Still in all, I enjoyed the read.",3.0
"Soulphisticated Ladies Episode 1by Jaha KnightThanks to Jaha Knight for the copy to review today.Soulphisticated Ladies is a book about all the things us women go through. Issues such as men, money, love and power.This book is based on a group of female friends who have different personalities, and trying to make it in this world.The girls are named Selah, Gennifer, Vashti, and Moria.  Selah a strong character, seems to be worried about the competition in her job from the so called Slithers.That would be Cin and her group of employees are known as the Slitherers , reminds me of Harry Potter. She is a sneaky manipulative woman with a team of snakes. They will try anythingto get to success, from stealing ideas of other agency's and Selah was the team Devine. They got things by working hard and working together.Then you have Moria who is married with kids, and by that you know right away she must be stressed with caring for kids and taking care of the household.Also she has in mind of having more kids. However it seems as her husband may be sleeping around. Vashti seems to be a great big snoop and able to catch a guys lies instantly. After her past experience with her ex, she was very well in figuring out a guy who is never telling the truth. Though Gennifer and Vashti tried to bring them more together with all their attempts to keep them together and not to allow Sloan, husband of Moria to fall for someone else. Unfortunately Vashti had some secrets she held in about sleeping with Sloan and didn't want her friends to know about it as well. Though it was before Sloan knew Vashit was friends with Moria at the time.In away to me Gennifer is like the kind trusted person of the group, always helping out. To continue, as the episode goes on, Gennifer and Vashti start digging deeper finding out that Sloan was doing more then paying rent for this girl he was sleeping with, but a bill for each Tuesday get together at the Masquerade Inn.Well that is most of the story and I rather not go and ruin it for all of you, but lets just say it gets juicy, page by page.So these girls do have a lot of baggage and things going on that happens in a typical life of many women. Its tough sometimes to juggle work, men and having time for yourself. This is only part one so, you can tell there is more drama to come. When it ends you will be wanting more! The fight that goes on and so much intense, I felt like I was watching a lifetime movie in a book.",5.0
"Found it to be too drawn out. It was an ok read but glad I didn't ""buy"" it.The ending was a surprise.",3.0
I love it! I'm a huge fan of the Chronicles of Kerrigan and was excited to see her have a collab of her series. I can't wait to start on the second books in each series and for the &#34;half&#34; book to come out! and I LOVE THE COVER!!,5.0
"I devoured this book - the Prologue (see below) pulled me in and I just had to finish the book. The author did a great job of keeping you right on the edge of your seat.Tia is Melissa's daughter, and she was raised by Melissa and Gracie after her father was killed in Afghanistan on the day she was born.  This family was dysfunctional from the start.  Melissa retreated into her own world and Gracie raised Melissa like she was her own child for the first couple of years.  I use the phrase ""like her own chld"" loosely here as I don't know any mother who would put their child through what these two did.  Gracie was the true criminal here while Melissa's crime was just being negligent and keeping her eyes closed to what was going on.After Tia is arrested, she refuses to talk to anyone. A very caring (and clever) Dr. Eaton or  ""psycho-doc"" as she calls him, gets her to trust him and convinces her to start keeping a journal.  She documents her life through her birthdays and what happens each year.  She finally reaches a point though, that she  can't remember what happened, or just refuses to remember what happened.  She lets Dr. Eaton read her journal - I think because it is all too painful for her to say out loud - but she wants someone to know.Between her journal writings and conversations that Melissa has with her also dysfunctional mother Louise, you begin to learn about Tia's life.  At times it is almost too painful to read, but I couldn't put it down.  The tension was just enough to keep me riveted.I really liked how the author resolved the book and brought some lost souls together in the end.",5.0
"Star Rating: 4.5 starsHeat Rating: HOT HOT&#34;..you should take comfort in the fact that this isn't really your decision at all.  Love finds you.  It's not the other way around.  The only choice you really have is whether or not you want to be found.&#34;Pieces of Perfect by Elizabeth Hayley had me from the first chapter!  I had no idea what I was in for reading this book but I was pleasantly surprised how much I LOVED this story!  You know from the blurb that this is going to be a love triangle, which to be honest, isn't my favorite plot lines, and I ate up every bite of this scrumptious book!Pieces of Perfect was HOT (right from the beginning) but it also made you stop and think about what you would do in Lily's shoes.  Sometimes love isn't cut and dry, sometimes you find yourself facing really tough choices and there is no right or wrong answer.  This book really was well done and gave the reader a lot to think about.  Elizabeth Hayley did a great job breathing life into Lily, Max and Adam's stories and I never could bring myself to pick a &#34;team&#34; I fell in love with both of them.My emotions were all over this place with this one, I was mad, happy, frustrated, shocked, heart broken and then satisfied.  Pieces of Perfect is one of the best love triangle books I have read, it handled things realistically and let the reader get inside what Lily was going through without her coming off like a heartless and cold person.Elizabeth Hayley make quite the writing team! I am addicted to this story and I really hope we get more from these three characters in the future (but if we don't I am OK with that too).  Pieces of Perfect is definitely a story that will be sticking with me for days to come.  I HIGHLY recommend this book, it will get you thinking about life, love and airports.  Go 1-click and enjoy this emotional ride with Lily this weekend.",4.0
An old-lady carjacker?  And also a mob lady?  Guess anything is possible with the writer's help.  It was just OK in my book.,3.0
this book was ok but it didn't have the intrigue and suspense .it made me think it was a couple of teenagers trying to act like adults.so I gave it a 2.,2.0
"What a wonderful book! I am a bit of a geek, so I totally love all the references in this story to Dr. Who, Supernatural, Justice League, Avengers...oh, the list goes on and on! I also felt that I was able to relate to Sera. If you've ever felt out of place or like the sore thumb (because you stuck out), this is the book for you. I can't wait to see more from C.M. Kars!",4.0
Great book regarding the Kindle publishing business. I've been meaning to enter this business too but I want to make sure I'm ready and equipped with all the information I need. This book really helped me a lot!,5.0
I really like the book I would have never thought she would be a big leader.  Hipe the next book comes out soon.,5.0
"Excellent ,well written a mater piece of worthy information that will benefit any one regardless of age. This book covers all the areas that is vital , a must read for every one wanting to improve on their skills of great conversation and so much more. Would give it ten stars but as you can see only five is allowed.",5.0
"Were to begin? I think that the only way to explain what I felt with this hook is to be honest. A month ago a friend recommend me ""Fringe"", the tv series, you know that series, right? It's about impossible things turning possible. And one of this crazy but intriguing possibilities are parallel universes.I'm simply in love with this matter, it makes me think, makes me want to understand things that are beyond reality. That's the reason I loved this book. ""Parallel"" was everything I expected and much, much more.There are so many questions I would like to ask the author, Claudia, now that I have read the book but I think I'm just going to wait for the second part, I believe it's going to be as exciting, fun and clever as this book.Don't hesitate, if you have the opportunity just buy it. I mean, I read this book really fast, I couldn't and, to be honest, wouldn't stop turning pages. Is not only the twists but the fact that, even if you are not a fan of science, the plot is not very complicated and the ending... I wish I could tell you more but you need to read it, seriously.",4.0
"Ginger Marcinkowski's stories about buttons that reveal family memories is my first read from this fine author.  I was immediately drawn into the Polk family saga and recalled the ""buttons"" in my own life.  Both of my grandmothers saved buttons in lovely old tins, as well as an elderly next door neighbor lady that I visited often.  How I loved going through those buttons and admiring the sparkly ones mostly, but bright colors and odd shapes piqued my imagination over and over.  I wonder if all my questions about these peculiar items were a nuisance to their collectors.Back to the story at hand, John Polk's family was ordinary, in that their ups and downs, dreams, tragedies, and faith in God were much like other families.  The subtle difference was the loving Christian characterization of John Polk.  I felt like part of the family around the blazing fire listening to John reveal memories through a button picked from an old tin box by one of his two daughters, grandchildren or himself.John's daughters were different from each other in their reactions to John's revelations.  Maureen, the oldest, displayed boredom with indifference.  Carol, the youngest, more like her gentle mother Ellen, was always caught up in the story and grasped the value of God's ultimate message.  Maureen was becoming rebellious in her identity and a worry to her parents.In fact, John had displayed rebellion in his youth that led to a drunken experience ending in tragedy; ultimately realizing the need for God's love and forgiveness in his life.  This story began in Plaster Rock, New Brunswick, Canada 1956 - nostalgic to my own years of being a teen and related easily to the years that followed to 1997 when this story concluded in a poignant intention of carrying on this family tradition.When I began reading this sweet novella, I was unaware that it is a sequel to Ms Marcinkowski's Run, River Currents.  Wishing I had read it before The Button Legacy, I intend to read Ginger Marcinkowski's Run, River Currents soon.  The character of John's granddaughter, Emily, was bittersweet and the favorite of her ""Grampy"" John.  Emily Evans, being the daughter of Maureen, might have followed in her mother's footsteps; however Grampy John was wise in the Lord, and effective in teaching a lesson of trust.Rich and deep in meaning of God's love are Ginger Marcinkowski's words - so compelling in faith and knowledge of God's Word.  The humor is addictive, causing giggles so hard my bed shook.  The button stories gather personal emotions of happiness and tears.  How our lives parallel our neighbors as well as in the generations before us are awesome and amazing to witness God's touch throughout.  Well done, Ms Marcinkowski.  Thank you for writing loud words of joyful noise.I received a free kindle copy of this story from Cross Focused Reviews in exchange for my honest review.",5.0
"First let me say that I am a Maureen Smith fan. And I faithfully stalked her website and FB page religiously. So, what a WONDERFUL surprise it was to see Seducing... was FINALLY available.I was not sure that I was going to like where Ms. Smith would go with Manning and Taylor's story; especially after 20years being apart. But, the way she explained their separate lives in detail helped with them coming together. I especially enjoyed Manning. Whew! He was so sexy and sinful...with His brilliant mind. I enjoyed seeing an author who was able to show an intelligent, strong Black man, who was able to be professional when he needed to be. And, able to turn it off and show his ""street cred"" too when hanging with his boyz and brothers. I also like the fact that Taylor was a smart, professional woman, with an inner freak waiting to come out- with Manning. (No more Tame Taylor!) I loved reading about the sights and sounds of Atlanta and Paris, as well as laughing at the impromptu step show at the bar-be-que. These descriptions showed a true knowledge of what was going on, or either some studying. Some of the conversations took me back to my college days. What great fun! I loved the strong bond and love that Manning and Taylor had for one another. He truly loved her like a goddess.I thoroughly enjoy Ms. Smith's writing because she ALWAYS shows strong men and women of color; along with positive family relationships. Don't get me wrong, there is always drama and secrets. But, there is also love, loyalty, and forgiveness. I always fond of her including the other characters from previous books, and how she incorporates them all together nicely. Great job Ms. Smith!!! I am truly looking forward to the next book with the Wolf Pack. Montana.... Mr. Sexy, sax Jazz player. Yummy!!",5.0
"We should all keep our business tool kit up-to-date and filled with anything that can help give us an edge.  This book does just that- it's filled with lots of information to help you prepare and be ready.  This one is on the money and made for 2013 - if you are even thinking of looking for a new job, you need all the tools you can get.  Great book!",5.0
"I bought this book because I read &#34;Why Her&#34;, &#34;Why Me&#34;, and &#34;Double Dose&#34;! Those books were so good that I'm thinking anything this author writes has to be good. The book started off great. It left off where &#34;Why Her&#34; series stopped but as I was reading other characters appeared that wasn't in the other books. I was so confused that I stopped reading the book. Come to find out those characters were from another series &#34;Salty&#34;. It's ok to put characters in your book from other books u wrote but don't make it confusing to the people that haven't read the series. I really wish I can get my money back cause I feel like I'm being bullied into buying Salty series. In other words &#34;Why Him&#34; is a continuation from the &#34;Salty&#34; series!!! And no I'm not buying the series!!!",1.0
"I love the story, it was amazing.  I loved every word, and the relationship between Kyo and Loki was well crafted, easy to follow, hot, steamy, sexy and awe inspiring.  I liked the fact that the author was not afraid to get creative.",5.0
"Eli Gaither runs the family business of salvaging valuable materials from old houses, polishing them up and selling them for a profit.  He is a divorced man in his 40&#8217;s with three basically grown children and a witch for an ex-wife.  He is also gay, well I think he labels himself as bi.  His youngest son is in high school and recently just shown up at his door.  He was caught with another boy having sex and his mother threw him out.  He had nowhere to go but his dad&#8217;s, whom he has only spoken to a few times since the divorce, which was the boy&#8217;s choice.Just as Eli is trying to deal with his quiet life now being tossed around by the addition of his son, he gets a call saying that Oscar is coming to see him.  Oscar is a young gay man who is comfortable with his sexuality and is an interior designer.  They met one day when Oscar went to Eli&#8217;s store to purchase some items for the company.  Being warned that Eli doesn&#8217;t like weak shy people, Oscar went in with flair.  This led to a night of sex at a hotel, where Eli left early morning and did something he will regret forever.This story takes us on their journey, overcoming the age difference, the miles between their prospective homes, and the overriding need for passion that they have for each other.  Eli is going to have to deal with not having the quiet life of a hermit any more, he is going to have to face the love for Oscar, the roles of being an active father to a son who hated him for the divorce and the ex-wife who would rather save her reputation with the church than deal with the issues at hand.  We learn his secrets from his past life and realize looks aren&#8217;t everything.Oscar is dealing with his boss who he adores being ill, we never find out what is the disease but we know it takes a toll on Oscar.  Also how is he going to convince Eli age is only a number and help him overcome his fears?While I found this book to have some editing problems, I didn&#8217;t feel it was worthy of taking a star away in the ratings.  I just found so many questions unanswered and directions that were not explained that I had a hard time really investing in the story.  The character development was good to a point, but I never felt I was able to really understand their emotions and story.  The discussion of their sex scenes was hot, but I also felt they were raw and lacked real intimacy. It felt more like two animals going at each other than showing us the love we were lead to believe.  I would recommend this book if you were into a quick read with no real investment, then you have a hit.  If you wanted something that would melt your heart and stay with you for a while, I am not sure you will find it here.Reviewed by Tbird for Crystal&#8217;s Many Reviewers*Copy provided for honest review*",3.0
I gave this story a five star review because it's very sexy and I love how you can see the passion between Hunter and vampire.,5.0
